{
  "node_id": "07_01_case_runner",
  "node_name": "case_runner",
  "node_name_ko": "케이스 실행기",
  "tree_id": "07_agent_harness",
  "tree_name": "Agent Harness Tree",
  "role": "Scenario Card와 입력 bundle을 기반으로 실행 케이스를 구성한다.",
  "status": "mvp",
  "risk_level": "medium",
  "inputs": [
    {
      "artifact_type": "scenario_card",
      "path_pattern": "data/sample/scenarios/SCN-*.json",
      "schema": "schemas/context/scenario_card.schema.json",
      "required": true
    }
  ],
  "outputs": [
    {
      "artifact_type": "run_case",
      "path_pattern": "data/sample/harness/RUN-*.json",
      "schema": "schemas/harness/run_case.schema.json",
      "required": true
    }
  ],
  "schemas": [
    "schemas/common/node_contract.schema.json",
    "schemas/harness/run_case.schema.json"
  ],
  "connected_nodes": [
    "07_02_tool_runner",
    "07_03_rag_runner",
    "07_05_evaluator_runner"
  ],
  "human_review_required": true,
  "notes": "MVP 기준 Node 정의. 업무 Flow 확정 전에는 입출력과 Schema 검증 중심으로 사용한다."
}
