{
  "node_id": "09_06_tool_selection_log",
  "node_name": "tool_selection_log",
  "node_name_ko": "도구 선택 기록",
  "tree_id": "09_ledger",
  "tree_name": "Ledger Tree",
  "role": "업무 단위별 도구 후보, 선택 이유, 보류/폐기 이유를 기록한다.",
  "status": "mvp",
  "risk_level": "low",
  "inputs": [],
  "outputs": [
    {
      "artifact_type": "tool_selection_entry",
      "path_pattern": "data/sample/ledgers/tool_selection_log.jsonl",
      "schema": "schemas/ledger/tool_selection_entry.schema.json",
      "required": true
    }
  ],
  "schemas": [
    "schemas/common/node_contract.schema.json",
    "schemas/ledger/tool_selection_entry.schema.json"
  ],
  "connected_nodes": [
    "10_02_fit_review"
  ],
  "human_review_required": true,
  "notes": "MVP 기준 Node 정의. 업무 Flow 확정 전에는 입출력과 Schema 검증 중심으로 사용한다."
}
