{
  "node_id": "03_04_rag_retriever",
  "node_name": "rag_retriever",
  "node_name_ko": "RAG 검색기",
  "tree_id": "03_rag",
  "tree_name": "RAG Tree",
  "role": "시험법, 불량현상, 설계사양 문서를 검색해 근거 후보를 만든다.",
  "status": "mvp",
  "risk_level": "medium",
  "inputs": [
    {
      "artifact_type": "rag_query",
      "path_pattern": "data/sample/rag/queries/RAGQ-*.json",
      "schema": "schemas/rag/rag_query.schema.json",
      "required": false
    },
    {
      "artifact_type": "rag_document",
      "path_pattern": "data/sample/rag/documents/DOC-*.json",
      "schema": "schemas/rag/rag_document.schema.json",
      "required": true
    }
  ],
  "outputs": [
    {
      "artifact_type": "evidence_candidate",
      "path_pattern": "data/sample/rag/evidence_candidates.jsonl",
      "schema": "schemas/rag/evidence_candidate.schema.json",
      "required": true
    }
  ],
  "schemas": [
    "schemas/common/node_contract.schema.json",
    "schemas/rag/rag_document.schema.json",
    "schemas/rag/evidence_candidate.schema.json"
  ],
  "connected_nodes": [
    "07_03_rag_runner",
    "09_02_evidence_ledger"
  ],
  "human_review_required": true,
  "notes": "MVP 기준 Node 정의. 업무 Flow 확정 전에는 입출력과 Schema 검증 중심으로 사용한다."
}
